{
  "feature_input_version": "0.1.0",
  "data_source": "SYNTHETIC_FIXTURE",
  "model_input_channel": "SYNTHETIC_CAPACITIVE",
  "source_window_end_ms": 120000,
  "feature_basis": "RAW_MINUS_SESSION_BASELINE",
  "feature_order": [
    "cap_delta_mean",
    "cap_delta_last",
    "cap_delta_slope_per_s",
    "cap_delta_variance",
    "cap_delta_range"
  ],
  "features": [0.0, 0.0, 0.0, 0.0, 0.0]
}
